{
  "schema": "auto-dev-stage-policy-decision/v1",
  "work_item_id": "072026-001_example",
  "canonical_work_id": "work_example",
  "domain": "example_domain",
  "project": "example_project",
  "stage": "document",
  "decision": "not_required",
  "reason": "The frozen project policy disables the standalone Document stage for this work item.",
  "decided_by": "operator:genome",
  "policy_fingerprint": "replace-with-the-effective-policy-fingerprint",
  "policy_source": {
    "ref": "/absolute/path/to/the-run/effective-policies.json",
    "sha256": "0000000000000000000000000000000000000000000000000000000000000000"
  },
  "verified_at": "2026-07-20T20:00:00Z"
}
